{
  "schema_version": "GovernancePreflightV1",
  "issue_number": 227,
  "branch": "phase-1-closure-process-227-demo-phase0-status-ledger",
  "objective": "Reconcile docs/STATUS.md after PR #226 merged and issue #225 closed so the repository-tracked ledger no longer points engineers or agents to the completed Demo Phase 0 planning issue as active work, while preserving the No-Go release posture and all prohibitions on product/runtime implementation, provider SDKs, provider keys, hosted deployment, real audio/video generation, cloned identity implementation, Product Mode 2, public synthetic-media distribution, and production-readiness claims.",
  "status_decision": "update-minimally",
  "scope": {
    "required": [
      "docs/governance/preflights/issue-227.json",
      "docs/STATUS.md"
    ],
    "allowed_prefixes": [
      "docs/governance/preflights/issue-227.json",
      "docs/STATUS.md"
    ],
    "forbidden": [
      "runtime product code",
      "backend/app/",
      "frontend/src/",
      "frontend/tests/",
      "docker-compose.yml",
      ".github/workflows/",
      "pyproject.toml",
      "uv.lock",
      "frontend/package.json",
      "frontend/package-lock.json",
      "provider SDKs",
      "provider keys",
      "external provider enablement",
      "real audio generation",
      "real video generation",
      "cloned identity implementation",
      "hosted deployment",
      "public synthetic-media distribution",
      "production-readiness claims",
      "Product Mode 2 implementation",
      "stopped evidence surfaces #162/#163/#166/#167/#168"
    ]
  }
}
