{
  "schema_version": "GovernancePreflightV1",
  "issue_number": 368,
  "branch": "stage8-368-google-tts-long-response-timeout",
  "objective": "From exact accepted main 26258de9131c7a92b8a94ab949a57727b125dee5 and tree 4f19c1abd287cce44397f749a4ff2b47b3078adc, correct only the reproduced package-11 long-response timeout under Issue #368 route freeze 5496222852 with body SHA-256 ada7eb0931fc087b4534ba8bb997b2915dd168591c5f115f3f5f639ece0a08b8. Permit an explicitly configured Google TTS timeout up to 180 seconds through one shared constant while preserving the existing default, exact provider and endpoint, response-size and concurrency bounds, activation/privacy/policy/budget/quota gates, durable attempt state, billable-unknown stop behavior, and zero automatic retries. Use exactly ten paths and at most 1220 charged lines. Tests use fakes only. This route authorizes no provider request, retry, narration egress, spend, media, human acceptance, deployment, release, production-readiness, or Cut 1 completion claim. Stop on base, tree, issue, route, path, budget, provider, endpoint, timeout, retry, credential, secret, network-test, security, hosted, approval, or authority drift.",
  "status_decision": "update-minimally",
  "scope": {
    "required": [
      "backend/app/google_tts_runtime.py",
      "backend/app/tts_provider.py",
      "tests/unit/test_google_tts_runtime.py",
      "tests/unit/test_stage6_tts_provider.py",
      "docs/governance/preflights/issue-368-google-tts-timeout.json",
      "scripts/quality/stage8_cut1_routes.py",
      "tests/unit/test_stage8_cut1_routes.py",
      "docs/STATUS.md",
      "docs/ADR/0056-cut1-google-gemini-tts.md",
      "docs/TRACEABILITY.md"
    ],
    "allowed_prefixes": [
      "backend/app/google_tts_runtime.py",
      "backend/app/tts_provider.py",
      "tests/unit/test_google_tts_runtime.py",
      "tests/unit/test_stage6_tts_provider.py",
      "docs/governance/preflights/issue-368-google-tts-timeout.json",
      "scripts/quality/stage8_cut1_routes.py",
      "tests/unit/test_stage8_cut1_routes.py",
      "docs/STATUS.md",
      "docs/ADR/0056-cut1-google-gemini-tts.md",
      "docs/TRACEABILITY.md"
    ],
    "forbidden": [
      ".github/",
      "frontend/",
      "backend/app/narration.py",
      "backend/app/cut1_audio.py",
      "backend/app/cut1_listening.py",
      "pyproject.toml",
      "uv.lock",
      "credentials/",
      "providers/",
      "media/",
      "deployment/",
      "release/"
    ]
  }
}
