{
  "schema_version": "GovernancePreflightV1",
  "issue_number": 267,
  "branch": "phase-1-closure-267-c3a-cp7-performance-probe",
  "objective": "C3A-CP7 implements the next Checkpoint 3A child checkpoint: an executable performance probe that runs the local product/API path and evaluates bounded local/mock runtime performance evidence for the controlled demo path. Positive claims: C3A-CP7-HARNESS-001 dispatches the performance probe as an implemented executable pytest probe with shell=False and bounded/redacted failure output while preserving CP1 API E2E, CP2 output-correctness, CP3 language-quality, CP4 media-artifacts, CP5 access/quota/retention, and CP6 security/observability probes; C3A-CP7-PERF-001 creates approved synthetic local project knowledge through API behavior, ingests/chunks/stores it, generates grounded walkthrough output, and records API-visible local/mock timing evidence for the critical path with run/request IDs, operation names, elapsed durations, explicit thresholds, local/mock posture, pass/fail status, and redacted failure context; C3A-CP7-NEG-001 proves docs/prose/static-snapshot checks, style-only status text, canned-success files, success-shaped dicts without runtime nonce/source/run binding, missing run/request/performance binding, stale evidence, cross-project replay, raw unsafe content leaks, timeout/subprocess failures, and implicit thresholds inadequate. The later real-browser E2E probe remains planned and does not complete Checkpoint 3A. Repository-ledger cleanup for PR #266 and issue #265 may be bundled because this is a substantive child checkpoint rather than a standalone status-only follow-up.",
  "status_decision": "update-minimally",
  "scope": {
    "required": [
      "docs/governance/preflights/issue-267.json",
      "docs/reviews/ISSUE_267_C3A_CP7_PREFLIGHT.md",
      "docs/QUALITY_GATES.md",
      "docs/STAGE_ISSUE_PLAN.md",
      "docs/STATUS.md",
      "docs/TRACEABILITY.md",
      "scripts/quality/check_checkpoint3_acceptance.py",
      "scripts/quality/check_phase1_closure_docs.py",
      "tests/unit/test_checkpoint3_acceptance_gate.py",
      "tests/unit/test_phase1_closure_docs.py",
      "tests/acceptance/test_checkpoint3_performance.py"
    ],
    "allowed_prefixes": [
      "docs/governance/preflights/issue-267.json",
      "docs/reviews/ISSUE_267_C3A_CP7_PREFLIGHT.md",
      "docs/QUALITY_GATES.md",
      "docs/STAGE_ISSUE_PLAN.md",
      "docs/STATUS.md",
      "docs/TRACEABILITY.md",
      "scripts/quality/check_checkpoint3_acceptance.py",
      "scripts/quality/check_phase1_closure_docs.py",
      "tests/unit/test_checkpoint3_acceptance_gate.py",
      "tests/unit/test_phase1_closure_docs.py",
      "tests/acceptance/test_checkpoint3_performance.py"
    ],
    "forbidden": [
      "private plan",
      "internal portfolio strategy",
      "reviewer targeting",
      "provider strategy details",
      "provider SDKs",
      "provider keys",
      "provider account setup",
      "provider dashboard configuration",
      "paid plan activation",
      "provider wallet funding",
      "model or voice selection",
      "real provider calls",
      "real provider test calls",
      "real provider payloads",
      "provider outputs",
      "paid spend",
      "external provider enablement",
      "cloned voice",
      "cloned face",
      "digital twin",
      "real-person likeness",
      "clone enrollment",
      "hosted deployment",
      "public URL",
      "public synthetic-media distribution",
      "production-readiness claims",
      "Checkpoint 3B implementation",
      "Checkpoint 3C implementation",
      "Product Mode 2 implementation",
      ".github/workflows/",
      "backend/app/providers/",
      "backend/app/stage4.py",
      "backend/app/stage6.py",
      "backend/app/stage7.py",
      "frontend/",
      "docker-compose.yml",
      "backend/Dockerfile",
      "frontend/Dockerfile",
      "pyproject.toml",
      "uv.lock",
      "frontend/package.json",
      "frontend/package-lock.json",
      "secrets",
      "private media",
      "real personal data",
      "stopped evidence surfaces #162/#163/#166/#167/#168"
    ]
  }
}
