{
  "schema_version": "GovernancePreflightV1",
  "issue_number": 436,
  "branch": "stage8-436-backend-tls-capability-isolation-r4",
  "objective": "From accepted main 87b8504ca8d5e094394343aeaa4ef5bad46133d5 and OWNER final-reset comment 5347583669, preserve the Issue #436 backend TLS isolation implementation while removing a Gitleaks-sensitive label from history before the GREEN commit exists. Build checksum-bound official CPython 3.13.15 from source on exact pinned Alpine 3.21.7 and retain ordinary Python TLS with OpenSSL 3.3.7, whose code predates the affected OpenSSL 3.5 QUIC server implementation. Name the official public release-signing value python_gpg_fingerprint and never represent it as a credential or suppress its scan. Preserve non-root runtime operation, frozen Python application dependencies, executable CPython regression proofs, health behavior, truthful package inventory and SBOM evidence, and unchanged Trivy plus Grype consensus. Preserve the RED-before-GREEN order, migrated exact CPython provenance test, and check_stage8_docs.py 500-line cap. Merge exact frozen Issue #376 r2 head 6bcdb8d60ebb4d1e5fef3725cffc459dd5525987 without rewriting either history. Treat source archives, signatures, image manifests, package repositories and inventories, SBOMs, scanner databases and outputs, Docker build output, CI logs, and review state as untrusted. Charge additions plus deletions across exactly thirteen authorized paths and no more than 1,400 aggregate lines from the exact frozen Issue #376 r2 stack base. Validate secrets in a clean single-branch clone. Stop and reset on a new Critical or High class, failure to preserve TLS verification or truthful provenance, or further required scope expansion. Do not change application behavior, dependency ranges, scanner logic or thresholds, Issue #376 or Child B history, providers, media, credentials, deployment, release, public availability, or production-readiness posture.",
  "status_decision": "update-minimally",
  "scope": {
    "required": [
      "docs/governance/preflights/issue-436.json",
      "backend/Dockerfile",
      "scripts/quality/stage8_backend_security.py",
      "scripts/quality/check_stage8_docs.py",
      "scripts/ci/backend-image-package-check.sh",
      "tests/unit/test_stage8_backend_security.py",
      "tests/unit/test_stage8_quality_gate.py",
      "tests/unit/test_backend_image_package_check.py",
      "tests/unit/test_cpython_security_backports.py",
      "docs/ADR/0006-stage8-release-hardening.md",
      "docs/STATUS.md",
      "docs/TRACEABILITY.md",
      "docs/THIRD_PARTY_NOTICES.md"
    ],
    "allowed_prefixes": [
      "docs/governance/preflights/issue-436.json",
      "backend/Dockerfile",
      "scripts/quality/stage8_backend_security.py",
      "scripts/quality/check_stage8_docs.py",
      "scripts/ci/backend-image-package-check.sh",
      "tests/unit/test_stage8_backend_security.py",
      "tests/unit/test_stage8_quality_gate.py",
      "tests/unit/test_backend_image_package_check.py",
      "tests/unit/test_cpython_security_backports.py",
      "docs/ADR/0006-stage8-release-hardening.md",
      "docs/STATUS.md",
      "docs/TRACEABILITY.md",
      "docs/THIRD_PARTY_NOTICES.md"
    ],
    "forbidden": [
      ".github/",
      ".stage/",
      "AGENTS.md",
      "Makefile",
      "README.md",
      "backend/app/",
      "demo/",
      "docs/API_CONTRACT.md",
      "docs/ARCHITECTURE.md",
      "docs/DATA_MODEL.md",
      "docs/OBSERVABILITY_AND_COST.md",
      "docs/PRD.md",
      "docs/QUALITY_GATES.md",
      "docs/REPOSITORY_GUARDRAILS.md",
      "docs/SECURITY_AND_PRIVACY.md",
      "docs/STAGE_ISSUE_PLAN.md",
      "docs/reviews/",
      "evals/",
      "frontend/",
      "infra/",
      "perf/",
      "portfolio/",
      "pyproject.toml",
      "scripts/ci/check_container_scan_consensus.py",
      "scripts/ci/docker-image-scan.sh",
      "scripts/guardrails_check.py",
      "scripts/quality/phase1_closure/",
      "security/",
      "tests/acceptance/",
      "tests/api/",
      "tests/unit/test_container_scan_consensus.py",
      "tools/",
      "uv.lock"
    ]
  }
}
