{
  "schema_version": "GovernancePreflightV1",
  "issue_number": 274,
  "branch": "phase-1-closure-c3b-pr1-consent-provenance-planning-274",
  "objective": "C3B-PR1 creates the public-safe Checkpoint 3B consent/provenance planning gate only. Positive claims: C3B-PR1-LEDGER-001 reconciles the repository ledger for PR #273 merged at 0f737c564f9245b66640988573ac04f4432e06d5 and issue #269 closed while keeping issue #249 open as the public Checkpoint 3 tracker; C3B-PR1-C3A-001 records that the currently listed Checkpoint 3A executable acceptance probe set is complete through CP1-CP8 without expanding that evidence into Checkpoint 3B, Checkpoint 3C, hosted/public demo, provider setup, cloned identity, real media, public distribution, or production readiness; C3B-PR1-BOUNDARY-001 defines Checkpoint 3B only as consent/provenance planning, acceptance contracts, risk boundaries, and future issue sequencing; C3B-PR1-GUARDRAIL-001 adds issue-specific branch/file allowlist and regression coverage that rejects near-match branches and unauthorized changed files. This PR must remain public-safe and must not expose private strategy, provider choices, reviewer strategy, invite codes, private media, real personal data, provider payloads, provider outputs, secrets, tokens, or credentials.",
  "status_decision": "update-minimally",
  "scope": {
    "required": [
      "docs/governance/preflights/issue-274.json",
      "docs/reviews/ISSUE_274_C3B_PR1_PREFLIGHT.md",
      "docs/QUALITY_GATES.md",
      "docs/STAGE_ISSUE_PLAN.md",
      "docs/STATUS.md",
      "docs/TRACEABILITY.md",
      "scripts/quality/check_phase1_closure_docs.py",
      "tests/unit/test_phase1_closure_docs.py"
    ],
    "allowed_prefixes": [
      "docs/governance/preflights/issue-274.json",
      "docs/reviews/ISSUE_274_C3B_PR1_PREFLIGHT.md",
      "docs/QUALITY_GATES.md",
      "docs/STAGE_ISSUE_PLAN.md",
      "docs/STATUS.md",
      "docs/TRACEABILITY.md",
      "scripts/quality/check_phase1_closure_docs.py",
      "tests/unit/test_phase1_closure_docs.py"
    ],
    "forbidden": [
      "private plan",
      "internal portfolio strategy",
      "reviewer targeting",
      "provider strategy details",
      "provider SDKs",
      "provider keys",
      "provider account setup",
      "provider dashboard configuration",
      "paid plan activation",
      "provider wallet funding",
      "model or voice selection",
      "real provider calls",
      "real provider test calls",
      "real provider payloads",
      "provider outputs",
      "paid spend",
      "external provider enablement",
      "cloned identity runtime",
      "cloned voice",
      "cloned face",
      "digital twin",
      "real-person likeness",
      "clone enrollment",
      "hosted deployment",
      "public URL",
      "public synthetic-media distribution",
      "production-readiness claims",
      "Checkpoint 3B implementation",
      "Checkpoint 3C implementation",
      "Product Mode 2 implementation",
      ".github/workflows/",
      "backend/",
      "frontend/",
      "docker-compose.yml",
      "backend/Dockerfile",
      "frontend/Dockerfile",
      "pyproject.toml",
      "uv.lock",
      "secrets",
      "private media",
      "real personal data",
      "stopped evidence surfaces #162/#163/#166/#167/#168"
    ]
  }
}
