{
  "schema_version": "GovernancePreflightV1",
  "issue_number": 324,
  "branch": "phase-1-closure-process-324-publication-boundary",
  "objective": "From synchronized main 11385d661e1da23f9be4101d9e8d3b3d2ca679e4 after PR #325 merged, its main quality run passed, and Issue #158 closed, establish Issue #324's prospective publication boundary without rewriting protected history. Authority is: owner-approved Issue #324; versioned publication contract and canonical merged product sources; executable gates/tests; runtime evidence; historical records as context only. PUBLIC is neutral product value, capabilities, legitimate audiences, limitations, and evidence. INTERNAL is owner delivery/distribution strategy kept only in genuine access-controlled storage outside this public repository. RESTRICTED is secrets, private/customer data, biometric media/enrollment evidence, and qualified-human legal, privacy, licensing, or security-risk records; none belongs here. Replace direct private-intent framing and the active legacy demo filename while preserving audience adaptation, semantic limits, launch No-Go, and historical evidence. Fail closed when internal/restricted labels, prompts, retrieval, model/provider output, metadata, logs/traces, search queries, filenames/URLs, or generated artifacts are proposed as public; vocabulary scanning is not DLP. Rollback is one bounded revert with no runtime effect. Enforce exactly 24 paths, at most 1800 charged lines, and 12 surfaces. Evidence requires a preflight-only first commit; current-main RED; direct, paraphrase, metadata, filename/URL, prompt, output, log/trace, search, provider, retrieval-promotion, duplicate, and missing-surface mutations; focused tests; make quality; guardrails; exact-head independent approval; reference-only merge wording; merged-tree closeout. Humans retain classification, public-language approval, private-system choice, and all legal/privacy/biometric/licensing/security-risk acceptance. No runtime, provider/media, Q&A, web, multilingual, hosting, deployment, release, production, PR #299, or holistic release-plan change.",
  "status_decision": "update-minimally",
  "scope": {
    "required": [
      "docs/governance/preflights/issue-324.json",
      "docs/governance/publication-boundary-v1.json",
      "docs/PUBLICATION_BOUNDARY.md",
      "docs/ADR/0047-publication-boundary.md",
      "README.md",
      "docs/AI_BUILD_BRIEF.md",
      "docs/PRODUCT_STRATEGY.md",
      "docs/PRD.md",
      "docs/NORTH_STAR_METRICS.md",
      "docs/ARCHITECTURE.md",
      "docs/SECURITY_AND_PRIVACY.md",
      "docs/OBSERVABILITY_AND_COST.md",
      "docs/THIRD_PARTY_NOTICES.md",
      "docs/demo/REAL_MEDIA_HOSTED_DEMO_PLAN.md",
      "docs/demo/CONTROLLED_LOCAL_DEMO.md",
      "portfolio/README.md",
      "docs/evals/phase1_golden_questions.jsonl",
      "docs/STAGE_ISSUE_PLAN.md",
      "docs/TRACEABILITY.md",
      "docs/STATUS.md",
      "scripts/quality/check_phase1_closure_docs.py",
      "tests/unit/test_phase1_closure_docs.py",
      "scripts/quality/check_stage8_docs.py",
      "tests/unit/test_stage8_quality_gate.py"
    ],
    "allowed_prefixes": [
      "docs/governance/preflights/issue-324.json",
      "docs/governance/publication-boundary-v1.json",
      "docs/PUBLICATION_BOUNDARY.md",
      "docs/ADR/0047-publication-boundary.md",
      "README.md",
      "docs/AI_BUILD_BRIEF.md",
      "docs/PRODUCT_STRATEGY.md",
      "docs/PRD.md",
      "docs/NORTH_STAR_METRICS.md",
      "docs/ARCHITECTURE.md",
      "docs/SECURITY_AND_PRIVACY.md",
      "docs/OBSERVABILITY_AND_COST.md",
      "docs/THIRD_PARTY_NOTICES.md",
      "docs/demo/REAL_MEDIA_HOSTED_DEMO_PLAN.md",
      "docs/demo/CONTROLLED_LOCAL_DEMO.md",
      "portfolio/README.md",
      "docs/evals/phase1_golden_questions.jsonl",
      "docs/STAGE_ISSUE_PLAN.md",
      "docs/TRACEABILITY.md",
      "docs/STATUS.md",
      "scripts/quality/check_phase1_closure_docs.py",
      "tests/unit/test_phase1_closure_docs.py",
      "scripts/quality/check_stage8_docs.py",
      "tests/unit/test_stage8_quality_gate.py"
    ],
    "forbidden": [
      ".github/pull_request_template.md",
      ".github/workflows/",
      "AGENTS.md",
      "backend/",
      "frontend/",
      "docs/governance/preflights/issue-158.json",
      "docs/governance/preflights/issue-294.json",
      "docs/reviews/ISSUE_294_REPLACEMENT_GOVERNANCE.md",
      "docs/evals/issue280_semantic_repair_slice1.json",
      "pyproject.toml",
      "uv.lock",
      "package.json",
      "package-lock.json",
      "Dockerfile",
      "docker-compose.yml",
      "PR #299 or protected forensic evidence mutation",
      "confidential strategy storage in the public repository",
      "product runtime provider media Q&A web multilingual hosting deployment release production change",
      "legal privacy biometric licensing or security-risk acceptance",
      "holistic release plan or Cut 1 through Cut 6 implementation"
    ]
  }
}
