{
  "schema_version": "GovernancePreflightV1",
  "issue_number": 217,
  "branch": "phase-1-closure-process-217-post-pr-216-status-reconciliation",
  "objective": "Reconcile repository-tracked status after PR #216 merged and issue #215 reached its completed GitHub disposition.",
  "status_decision": "update-minimally",
  "scope": {
    "required": [
      "docs/governance/preflights/issue-217.json",
      "docs/STATUS.md",
      "scripts/quality/check_phase1_closure_docs.py"
    ],
    "allowed_prefixes": [
      "docs/governance/preflights/issue-217.json",
      "docs/STATUS.md",
      "scripts/quality/check_phase1_closure_docs.py",
      "tests/unit/test_phase1_closure_docs.py"
    ],
    "forbidden": [
      "Product Mode 2",
      "real audio",
      "MP4/WebM",
      "STT/imported video",
      "external providers",
      "hosted launch",
      "public distribution",
      "production readiness",
      "multi-worker claims",
      "provider SDKs",
      "provider keys",
      "runtime product code",
      "backend/app/",
      "frontend/src/",
      "frontend/tests/",
      "docker-compose.yml",
      ".github/workflows/",
      "pyproject.toml",
      "uv.lock",
      "frontend/package.json",
      "frontend/package-lock.json",
      "stopped evidence surfaces #162/#163/#166/#167/#168"
    ]
  }
}
