{
  "schema_version": "GovernancePreflightV1",
  "issue_number": 551,
  "branch": "phase-1-closure-process-551-provider-input-environment-qualification",
  "objective": "Refs #551; Issue550 comment5735557091 governs product-first sequencing. From main 2fc1bbd7904421d4a5a2c85995c28dbd9cdf0fce, prepare source-bound six-group/eight-role provider/input/environment qualification, PVR driver/rights/audio brief, unchanged P1E readiness delta and NON_EXECUTABLE_NULL_AUTHORITY_DRAFT. Frozen550 head 83d107e2d5261ae8aaa497b8e044929a6bc751b1/tree 194e35e1cb175b43be659b9f32a9a1873b1b6428/P1E SHA256 34b261d990297bd5d37b9ce47169cb298498713f4327d208bdb3904df69b4d55 remains LOCAL_VERIFIED_REMOTE_UNPUBLISHED; never copy, mutate or transfer reviews. CI governs publication, not zero-operation preparation. Preserve rejected/no-repeat routes, unknowns, real moving driver versus style-only office versus coherent generated world, and falsifiable P0/P1/P1D/P2 gates. C1 preflight only; stop for root exact-C1 review. Later scope 13 paths, target 900/hard 1200 charged lines, no deletion credit. Route module/runner/tests enforce branch/base/C1/scope/budget only; no semantic activation validator. Registry only governance-backlog STATUS hash/size pointer; no inventory or plan-pointer changes. Root owns integration/merge; lead sole writer; maximum 3 completed exact-head PR review cycles and 2 corrections, no reset. Resource owner Package551 lead: isolated checkout/Git metadata/bounded text/validation; cap 196608KiB, floor 14680064KiB, admission 14876672KiB; fresh free 15354764KiB at 2026-09-18T21:44:14Z. Retain for active review; recheck at root merge/abandonment closeout against exact base/C1 and retained evidence recovery. No cleanup here. Zero acquisition, derivative creation, private reads, browser/account/credentials, upload/generation/media, spend/retry/repair/fallback, deployment/publication or product acceptance. No installs/env/cache/Docker/server; preserve KEEP image and other checkouts.",
  "status_decision": "update-minimally",
  "change_budget": {
    "exact_paths": 13,
    "maximum_additions_plus_deletions": 1200,
    "deletions_grant_credit": false,
    "per_file_charged_lines": {
      "docs/governance/preflights/issue-551.json": 180,
      "docs/work/demo-comparison/PROVIDER_INPUT_ENVIRONMENT_QUALIFICATION.md": 450,
      "docs/work/demo-comparison/README.md": 30,
      "docs/work/demo-comparison/DECISIONS.md": 40,
      "docs/work/demo-comparison/HANDOFF.md": 80,
      "docs/work/demo-comparison/evidence/INDEX.json": 60,
      "docs/work/demo-comparison/evidence/REVIEWS.md": 80,
      "docs/STATUS.md": 50,
      "docs/work/registry.json": 10,
      "docs/work/governance-backlog/HANDOFF.md": 20,
      "scripts/quality/issue551_provider_input_qualification_route.py": 130,
      "scripts/quality/phase1_closure/runner.py": 10,
      "tests/unit/test_issue551_provider_input_qualification_route.py": 200
    }
  },
  "scope": {
    "required": [
      "docs/governance/preflights/issue-551.json",
      "docs/work/demo-comparison/PROVIDER_INPUT_ENVIRONMENT_QUALIFICATION.md",
      "docs/work/demo-comparison/README.md",
      "docs/work/demo-comparison/DECISIONS.md",
      "docs/work/demo-comparison/HANDOFF.md",
      "docs/work/demo-comparison/evidence/INDEX.json",
      "docs/work/demo-comparison/evidence/REVIEWS.md",
      "docs/STATUS.md",
      "docs/work/registry.json",
      "docs/work/governance-backlog/HANDOFF.md",
      "scripts/quality/issue551_provider_input_qualification_route.py",
      "scripts/quality/phase1_closure/runner.py",
      "tests/unit/test_issue551_provider_input_qualification_route.py"
    ],
    "allowed_prefixes": [
      "docs/governance/preflights/issue-551.json",
      "docs/work/demo-comparison/PROVIDER_INPUT_ENVIRONMENT_QUALIFICATION.md",
      "docs/work/demo-comparison/README.md",
      "docs/work/demo-comparison/DECISIONS.md",
      "docs/work/demo-comparison/HANDOFF.md",
      "docs/work/demo-comparison/evidence/INDEX.json",
      "docs/work/demo-comparison/evidence/REVIEWS.md",
      "docs/STATUS.md",
      "docs/work/registry.json",
      "docs/work/governance-backlog/HANDOFF.md",
      "scripts/quality/issue551_provider_input_qualification_route.py",
      "scripts/quality/phase1_closure/runner.py",
      "tests/unit/test_issue551_provider_input_qualification_route.py"
    ],
    "forbidden": [
      "AGENTS.md",
      ".github/",
      "backend/",
      "frontend/",
      "assets/",
      "data/",
      "reports/",
      "pyproject.toml",
      "uv.lock",
      "docs/work/INDEX.md",
      "docs/work/demo-comparison/PLAN.md",
      "docs/work/demo-comparison/EXECUTION_PLAN.md",
      "docs/work/demo-comparison/HFE1_P1E_PREVISUALIZATION.json",
      "docs/work-archive/",
      "docs/work/g1-certification/",
      "docs/ADR/",
      "docs/governance/schemas/",
      "docs/governance/preflights/issue-550.json",
      "scripts/quality/issue550_hfe1_p1e.py",
      "tests/unit/test_issue550_hfe1_p1e.py",
      "scripts/governance_preflight_v1.py",
      "scripts/governance_preflight_repository.py",
      "scripts/guardrails_check.py",
      "docs/QUALITY_GATES.md",
      "docs/templates/NEW_PROJECT_ENGINEERING_PLAYBOOK.md"
    ]
  }
}
