{
  "schema_version": "GovernancePreflightV1",
  "issue_number": 360,
  "branch": "cut1-process-360-security-brace-expansion-5-0-9-unblock",
  "objective": "From exact base b9a2a8cd4aa05328116565990fc30ae44592c875, converge the two known mandatory dependency findings: frontend development-tool brace-expansion 5.0.8 to exactly 5.0.9 for GHSA-rgw5-rvv9-x895 / CVE-2026-69152, and isolated Semgrep cryptography 49.0.0 to exactly 50.0.0 for GHSA-g6cj-pr64-35w5 / CVE-2026-69247 using only the authorized security/documentation deltas from immutable Issue #359 head c2f1c22c75c75cfaf3eb6e94c1445f8ac834d892. Authority is Issue #360 owner-amendment comment 5181789935. Preserve every other npm/tool package version, Semgrep 1.168.0, PyJWT 2.13.0, Click 8.3.3, MCP 1.28.1, all direct dependencies/overrides, reviewed-input binding, zero ignores, and zero waivers. Require committed RED proof, exact 18-path route/mutations, 650-line hard ceiling, both strict audits, frontend gates, Semgrep validation/scan/canaries, historical Stage 8 tests, context budgets, guardrails, security, policy-only/full quality, CI, exact-head checks, and fresh independent security/technical review. Issue #359 remains open and immutable until convergence merge and merged-main verification; Issue #150 and its 2026-08-13 expiry and Issue #358 remain unchanged. No product, provider, runtime, deployment, release, public-hosting, production-readiness, or Cut 1 completion authority is granted. Stop for authority/head drift, any other package delta, a nineteenth path, more than 650 charged lines, checker over 500 lines, sidecar/test budget breach, a third repair round, weakening/suppression/waiver/downgrade/risk acceptance, or any unresolved mandatory/high/critical finding.",
  "status_decision": "update-minimally",
  "scope": {
    "required": [
      "docs/governance/preflights/issue-360.json",
      "docs/QUALITY_GATES.md",
      "docs/SECURITY_AND_PRIVACY.md",
      "docs/STAGE_ISSUE_PLAN.md",
      "docs/STATUS.md",
      "docs/THIRD_PARTY_NOTICES.md",
      "docs/TRACEABILITY.md",
      "docs/ADR/0049-semgrep-cryptography-50-lock-refresh.md",
      "docs/ADR/0050-brace-expansion-5-0-9-security-refresh.md",
      "frontend/package.json",
      "frontend/package-lock.json",
      "scripts/ci/check_semgrep_security.py",
      "scripts/quality/check_stage8_docs.py",
      "scripts/quality/stage8_brace_expansion_unblock.py",
      "tests/unit/test_dependency_security_contract.py",
      "tests/unit/test_stage8_brace_expansion_unblock.py",
      "tools/semgrep/reviewed-inputs.sha256",
      "tools/semgrep/uv.lock"
    ],
    "allowed_prefixes": [
      "docs/governance/preflights/issue-360.json",
      "docs/QUALITY_GATES.md",
      "docs/SECURITY_AND_PRIVACY.md",
      "docs/STAGE_ISSUE_PLAN.md",
      "docs/STATUS.md",
      "docs/THIRD_PARTY_NOTICES.md",
      "docs/TRACEABILITY.md",
      "docs/ADR/0049-semgrep-cryptography-50-lock-refresh.md",
      "docs/ADR/0050-brace-expansion-5-0-9-security-refresh.md",
      "frontend/package.json",
      "frontend/package-lock.json",
      "scripts/ci/check_semgrep_security.py",
      "scripts/quality/check_stage8_docs.py",
      "scripts/quality/stage8_brace_expansion_unblock.py",
      "tests/unit/test_dependency_security_contract.py",
      "tests/unit/test_stage8_brace_expansion_unblock.py",
      "tools/semgrep/reviewed-inputs.sha256",
      "tools/semgrep/uv.lock"
    ],
    "forbidden": [
      ".github/",
      ".stage/",
      "AGENTS.md",
      "Makefile",
      "README.md",
      "backend/",
      "demo/",
      "docs/reviews/",
      "evals/",
      "frontend/Dockerfile",
      "frontend/src/",
      "frontend/tests/",
      "perf/",
      "portfolio/",
      "pyproject.toml",
      "scripts/guardrails_check.py",
      "scripts/quality/check_quality_stage.py",
      "tests/api/",
      "tests/unit/test_stage8_quality_gate.py",
      "uv.lock"
    ]
  }
}
