{
  "schema_version": "GovernancePreflightV1",
  "issue_number": 471,
  "branch": "governance-471-cleanup-authority-anchor",
  "objective": "From exact accepted main 7eb4b99d7bc2bcf11cfc8c959baacb6cf3a21e81 and prospective authority comments 5469282050 and 5469309499, independently anchor the intended AGENTS.md SHA-256 7222909116385fe74cbc7df6bbccb759687d2e4a6bf0e0637465679434de33ab and playbook SHA-256 30ba0f8e7b736293c4b6c110cbe9ce46bf7639507b0441bd37cb222bb62ae94f outside PR #470 ownership. Use an independently imported hash callable, fail closed whenever either authority path changes to other bytes, require future authority changes to update and merge this anchor first in a separate reviewed lane, and preserve direct-head and merge-checkout parity. Use exactly six paths with no more than 1400 aggregate charged lines and per-path caps of 240, 100, 260, 360, 180, and 260 in route order. Stop on base, path, budget, hash, context, hosted, approval, ownership, or destructive-operation drift. Create no product, provider, audio, credential, egress, spend, deployment, release, production-readiness, T05, or Cut 1 acceptance authority.",
  "status_decision": "update-minimally",
  "scope": {
    "required": [
      "docs/governance/preflights/issue-471-cleanup-authority-anchor.json",
      "docs/STATUS.md",
      "scripts/guardrails_check.py",
      "tests/unit/test_guardrails_check.py",
      "scripts/quality/stage8_cut1_routes.py",
      "tests/unit/test_stage8_cut1_routes.py"
    ],
    "allowed_prefixes": [
      "docs/governance/preflights/issue-471-cleanup-authority-anchor.json",
      "docs/STATUS.md",
      "scripts/guardrails_check.py",
      "tests/unit/test_guardrails_check.py",
      "scripts/quality/stage8_cut1_routes.py",
      "tests/unit/test_stage8_cut1_routes.py"
    ],
    "forbidden": [
      "AGENTS.md",
      "docs/templates/NEW_PROJECT_ENGINEERING_PLAYBOOK.md",
      ".github/",
      "backend/",
      "frontend/",
      "pyproject.toml",
      "uv.lock",
      "credentials",
      "provider",
      "audio",
      "media"
    ]
  }
}
